{
  "schema": "liquilens.reference-fx-sample.v1",
  "captured_at": "2026-10-10T19:20:14.503085+00:00",
  "rights_scope": "four_ecb_reference_fx_series_only",
  "notice": "Source: European Central Bank. Original reference data is available free from the ECB. Informational reference rates, not executable quotes.",
  "transformation": "ECB XML values to dated CSV/JSON; no interpolation, inversion or economic adjustment.",
  "point_in_time_eligible": false,
  "row_count": 80,
  "rows": [
    {
      "series_id": "ECBFX_USD",
      "base_currency": "EUR",
      "quote_currency": "USD",
      "observation_date": "2026-09-14",
      "value": "1.1551",
      "unit": "USD/EUR",
      "source_retrieved_at": "2026-10-10T16:07:22+00:00",
      "sample_captured_at": "2026-10-10T19:20:14.503085+00:00",
      "source_staleness": "fresh",
      "vintage": "current_amended",
      "first_available_at": null,
      "source_publisher": "European Central Bank",
      "source_url": "https://www.ecb.europa.eu/stats/eurofxref/eurofxref-hist-90d.xml",
      "delivery_url": "https://api.seiche.info/api/series/ECBFX_USD.csv",
      "rights_url": "https://www.ecb.europa.eu/services/using-our-site/disclaimer/html/index.en.html",
      "notice": "Source: European Central Bank. Original reference data is available free from the ECB. Informational reference rates, not executable quotes."
    },
    {
      "series_id": "ECBFX_USD",
      "base_currency": "EUR",
      "quote_currency": "USD",
      "observation_date": "2026-09-15",
      "value": "1.1539",
      "unit": "USD/EUR",
      "source_retrieved_at": "2026-10-10T16:07:22+00:00",
      "sample_captured_at": "2026-10-10T19:20:14.503085+00:00",
      "source_staleness": "fresh",
      "vintage": "current_amended",
      "first_available_at": null,
      "source_publisher": "European Central Bank",
      "source_url": "https://www.ecb.europa.eu/stats/eurofxref/eurofxref-hist-90d.xml",
      "delivery_url": "https://api.seiche.info/api/series/ECBFX_USD.csv",
      "rights_url": "https://www.ecb.europa.eu/services/using-our-site/disclaimer/html/index.en.html",
      "notice": "Source: European Central Bank. Original reference data is available free from the ECB. Informational reference rates, not executable quotes."
    },
    {
      "series_id": "ECBFX_USD",
      "base_currency": "EUR",
      "quote_currency": "USD",
      "observation_date": "2026-09-16",
      "value": "1.1537",
      "unit": "USD/EUR",
      "source_retrieved_at": "2026-10-10T16:07:22+00:00",
      "sample_captured_at": "2026-10-10T19:20:14.503085+00:00",
      "source_staleness": "fresh",
      "vintage": "current_amended",
      "first_available_at": null,
      "source_publisher": "European Central Bank",
      "source_url": "https://www.ecb.europa.eu/stats/eurofxref/eurofxref-hist-90d.xml",
      "delivery_url": "https://api.seiche.info/api/series/ECBFX_USD.csv",
      "rights_url": "https://www.ecb.europa.eu/services/using-our-site/disclaimer/html/index.en.html",
      "notice": "Source: European Central Bank. Original reference data is available free from the ECB. Informational reference rates, not executable quotes."
    },
    {
      "series_id": "ECBFX_USD",
      "base_currency": "EUR",
      "quote_currency": "USD",
      "observation_date": "2026-09-17",
      "value": "1.1481",
      "unit": "USD/EUR",
      "source_retrieved_at": "2026-10-10T16:07:22+00:00",
      "sample_captured_at": "2026-10-10T19:20:14.503085+00:00",
      "source_staleness": "fresh",
      "vintage": "current_amended",
      "first_available_at": null,
      "source_publisher": "European Central Bank",
      "source_url": "https://www.ecb.europa.eu/stats/eurofxref/eurofxref-hist-90d.xml",
      "delivery_url": "https://api.seiche.info/api/series/ECBFX_USD.csv",
      "rights_url": "https://www.ecb.europa.eu/services/using-our-site/disclaimer/html/index.en.html",
      "notice": "Source: European Central Bank. Original reference data is available free from the ECB. Informational reference rates, not executable quotes."
    },
    {
      "series_id": "ECBFX_USD",
      "base_currency": "EUR",
      "quote_currency": "USD",
      "observation_date": "2026-09-18",
      "value": "1.146",
      "unit": "USD/EUR",
      "source_retrieved_at": "2026-10-10T16:07:22+00:00",
      "sample_captured_at": "2026-10-10T19:20:14.503085+00:00",
      "source_staleness": "fresh",
      "vintage": "current_amended",
      "first_available_at": null,
      "source_publisher": "European Central Bank",
      "source_url": "https://www.ecb.europa.eu/stats/eurofxref/eurofxref-hist-90d.xml",
      "delivery_url": "https://api.seiche.info/api/series/ECBFX_USD.csv",
      "rights_url": "https://www.ecb.europa.eu/services/using-our-site/disclaimer/html/index.en.html",
      "notice": "Source: European Central Bank. Original reference data is available free from the ECB. Informational reference rates, not executable quotes."
    },
    {
      "series_id": "ECBFX_USD",
      "base_currency": "EUR",
      "quote_currency": "USD",
      "observation_date": "2026-09-21",
      "value": "1.149",
      "unit": "USD/EUR",
      "source_retrieved_at": "2026-10-10T16:07:22+00:00",
      "sample_captured_at": "2026-10-10T19:20:14.503085+00:00",
      "source_staleness": "fresh",
      "vintage": "current_amended",
      "first_available_at": null,
      "source_publisher": "European Central Bank",
      "source_url": "https://www.ecb.europa.eu/stats/eurofxref/eurofxref-hist-90d.xml",
      "delivery_url": "https://api.seiche.info/api/series/ECBFX_USD.csv",
      "rights_url": "https://www.ecb.europa.eu/services/using-our-site/disclaimer/html/index.en.html",
      "notice": "Source: European Central Bank. Original reference data is available free from the ECB. Informational reference rates, not executable quotes."
    },
    {
      "series_id": "ECBFX_USD",
      "base_currency": "EUR",
      "quote_currency": "USD",
      "observation_date": "2026-09-22",
      "value": "1.1463",
      "unit": "USD/EUR",
      "source_retrieved_at": "2026-10-10T16:07:22+00:00",
      "sample_captured_at": "2026-10-10T19:20:14.503085+00:00",
      "source_staleness": "fresh",
      "vintage": "current_amended",
      "first_available_at": null,
      "source_publisher": "European Central Bank",
      "source_url": "https://www.ecb.europa.eu/stats/eurofxref/eurofxref-hist-90d.xml",
      "delivery_url": "https://api.seiche.info/api/series/ECBFX_USD.csv",
      "rights_url": "https://www.ecb.europa.eu/services/using-our-site/disclaimer/html/index.en.html",
      "notice": "Source: European Central Bank. Original reference data is available free from the ECB. Informational reference rates, not executable quotes."
    },
    {
      "series_id": "ECBFX_USD",
      "base_currency": "EUR",
      "quote_currency": "USD",
      "observation_date": "2026-09-23",
      "value": "1.1411",
      "unit": "USD/EUR",
      "source_retrieved_at": "2026-10-10T16:07:22+00:00",
      "sample_captured_at": "2026-10-10T19:20:14.503085+00:00",
      "source_staleness": "fresh",
      "vintage": "current_amended",
      "first_available_at": null,
      "source_publisher": "European Central Bank",
      "source_url": "https://www.ecb.europa.eu/stats/eurofxref/eurofxref-hist-90d.xml",
      "delivery_url": "https://api.seiche.info/api/series/ECBFX_USD.csv",
      "rights_url": "https://www.ecb.europa.eu/services/using-our-site/disclaimer/html/index.en.html",
      "notice": "Source: European Central Bank. Original reference data is available free from the ECB. Informational reference rates, not executable quotes."
    },
    {
      "series_id": "ECBFX_USD",
      "base_currency": "EUR",
      "quote_currency": "USD",
      "observation_date": "2026-09-24",
      "value": "1.1367",
      "unit": "USD/EUR",
      "source_retrieved_at": "2026-10-10T16:07:22+00:00",
      "sample_captured_at": "2026-10-10T19:20:14.503085+00:00",
      "source_staleness": "fresh",
      "vintage": "current_amended",
      "first_available_at": null,
      "source_publisher": "European Central Bank",
      "source_url": "https://www.ecb.europa.eu/stats/eurofxref/eurofxref-hist-90d.xml",
      "delivery_url": "https://api.seiche.info/api/series/ECBFX_USD.csv",
      "rights_url": "https://www.ecb.europa.eu/services/using-our-site/disclaimer/html/index.en.html",
      "notice": "Source: European Central Bank. Original reference data is available free from the ECB. Informational reference rates, not executable quotes."
    },
    {
      "series_id": "ECBFX_USD",
      "base_currency": "EUR",
      "quote_currency": "USD",
      "observation_date": "2026-09-25",
      "value": "1.1403",
      "unit": "USD/EUR",
      "source_retrieved_at": "2026-10-10T16:07:22+00:00",
      "sample_captured_at": "2026-10-10T19:20:14.503085+00:00",
      "source_staleness": "fresh",
      "vintage": "current_amended",
      "first_available_at": null,
      "source_publisher": "European Central Bank",
      "source_url": "https://www.ecb.europa.eu/stats/eurofxref/eurofxref-hist-90d.xml",
      "delivery_url": "https://api.seiche.info/api/series/ECBFX_USD.csv",
      "rights_url": "https://www.ecb.europa.eu/services/using-our-site/disclaimer/html/index.en.html",
      "notice": "Source: European Central Bank. Original reference data is available free from the ECB. Informational reference rates, not executable quotes."
    },
    {
      "series_id": "ECBFX_USD",
      "base_currency": "EUR",
      "quote_currency": "USD",
      "observation_date": "2026-09-28",
      "value": "1.1378",
      "unit": "USD/EUR",
      "source_retrieved_at": "2026-10-10T16:07:22+00:00",
      "sample_captured_at": "2026-10-10T19:20:14.503085+00:00",
      "source_staleness": "fresh",
      "vintage": "current_amended",
      "first_available_at": null,
      "source_publisher": "European Central Bank",